{
  "$schema": "https://json-schema.org/draft/2020-12/schema",
  "$id": "aios/trace-event.schema.json",
  "title": "AIOS Trace Event",
  "type": "object",
  "required": ["event_id", "timestamp", "source", "kind"],
  "properties": {
    "schema_version": { "type": "string" },
    "event_id": { "type": "string", "minLength": 1 },
    "timestamp": { "type": "string", "format": "date-time" },
    "generated_at": { "type": "string", "format": "date-time" },
    "source": { "type": "string", "minLength": 1 },
    "kind": { "type": "string", "minLength": 1 },
    "task_id": { "type": "string" },
    "session_id": { "type": "string" },
    "provider_id": { "type": "string" },
    "approval_id": { "type": "string" },
    "update_id": { "type": "string" },
    "boot_id": { "type": "string" },
    "image_id": { "type": "string" },
    "artifact_path": { "type": "string" },
    "payload": { "type": "object" },
    "notes": {
      "type": "array",
      "items": { "type": "string" }
    }
  },
  "additionalProperties": true
}
